{
  "id": "atraso-entrega",
  "versao": "1.0.0",
  "titulo": "O produto não foi entregue no prazo",
  "categoria": "entrega",
  "palavras_chave": ["atraso", "entrega", "prazo", "não chegou", "encomenda", "pedido"],
  "resumo": "Fornecedor descumpre o prazo de entrega prometido. Consumidor escolhe entre cumprimento, produto equivalente ou rescisão.",
  "fonte": "Dúvidas Frequentes PROCON Jacareí — caso 15",
  "no_inicial": "inicio",
  "nos": {
    "inicio": {
      "tipo": "pergunta",
      "texto": "Vamos verificar sua situação.\n\nO prazo de entrega prometido pela empresa já venceu?",
      "opcoes": [
        { "id": "venceu", "rotulo": "Sim, já venceu", "proximo": "escolha" },
        { "id": "nao_venceu", "rotulo": "Ainda não venceu", "proximo": "orienta_aguardar" },
        { "id": "nao_sei", "rotulo": "Não sei o prazo", "proximo": "orienta_verificar_prazo" }
      ]
    },
    "escolha": {
      "tipo": "pergunta",
      "texto": "Quando o prazo é descumprido, a escolha do que fazer é sua. A empresa não pode decidir por você.\n\nO que você prefere?",
      "opcoes": [
        { "id": "cumprimento", "rotulo": "Receber o produto", "proximo": "orienta_cumprimento" },
        { "id": "equivalente", "rotulo": "Produto equivalente", "proximo": "orienta_equivalente" },
        { "id": "cancelar", "rotulo": "Cancelar e reembolso", "proximo": "orienta_rescisao" }
      ]
    },
    "orienta_cumprimento": {
      "tipo": "orientacao",
      "texto": "Você optou por exigir a entrega do produto que comprou. Essa é uma das três alternativas que a lei coloca à sua disposição, e a escolha cabe a você.\n\nA empresa deve cumprir o que foi anunciado, nos termos da oferta.\n\nRegistre o pedido junto à empresa por escrito, com prazo definido, e guarde o protocolo. Se a entrega continuar não acontecendo, abra uma reclamação no PROCON.",
      "documentos": [
        "RG com CPF",
        "Comprovante da compra com o prazo de entrega prometido",
        "Comprovantes de pagamento",
        "Protocolos e mensagens trocadas com a empresa",
        "CNPJ da matriz do fornecedor"
      ],
      "ressalvas": [
        "Você pode mudar de opção enquanto o problema não for resolvido.",
        "Cada caso tem particularidades. É necessário comparecer presencialmente ao PROCON para uma análise detalhada."
      ],
      "base_legal": [
        { "norma": "CDC", "dispositivo": "Art. 35, I", "resumo": "Exigir o cumprimento forçado da obrigação nos termos da oferta" },
        { "norma": "CDC", "dispositivo": "Art. 30", "resumo": "A oferta vincula o fornecedor e integra o contrato" }
      ],
      "encaminhamento": "agendamento_presencial"
    },
    "orienta_equivalente": {
      "tipo": "orientacao",
      "texto": "Você optou por aceitar outro produto ou serviço equivalente no lugar do que foi comprado.\n\nEquivalente significa de valor e características compatíveis com o original. Se o substituto for mais caro, é razoável negociar quem arca com a diferença; se for mais barato, você tem direito à devolução do valor excedente.\n\nFormalize a proposta com a empresa por escrito, descrevendo qual produto você aceita receber, e guarde o registro.",
      "documentos": [
        "RG com CPF",
        "Comprovante da compra com o prazo de entrega prometido",
        "Comprovantes de pagamento",
        "Protocolos e mensagens trocadas com a empresa",
        "CNPJ da matriz do fornecedor"
      ],
      "ressalvas": [
        "A definição do que é equivalente pode gerar divergência e merece análise do caso.",
        "É necessário comparecer presencialmente ao PROCON para uma análise detalhada."
      ],
      "base_legal": [
        { "norma": "CDC", "dispositivo": "Art. 35, II", "resumo": "Aceitar outro produto ou prestação de serviço equivalente" }
      ],
      "encaminhamento": "agendamento_presencial"
    },
    "orienta_rescisao": {
      "tipo": "orientacao",
      "texto": "Você optou por cancelar a compra e receber o dinheiro de volta.\n\nNesse caso, você tem direito à restituição de todo o valor que já pagou, com correção monetária. Se o atraso causou prejuízos comprováveis, também é possível pleitear perdas e danos.\n\nComunique o cancelamento à empresa por escrito e guarde o protocolo. Se o reembolso não vier, ou vier incompleto, abra uma reclamação no PROCON.",
      "documentos": [
        "RG com CPF",
        "Comprovante da compra com o prazo de entrega prometido",
        "Comprovantes de pagamento",
        "Registro do pedido de cancelamento",
        "Protocolos e mensagens trocadas com a empresa",
        "CNPJ da matriz do fornecedor"
      ],
      "ressalvas": [
        "O prazo de reembolso pode variar conforme a forma de pagamento utilizada.",
        "Cada caso tem particularidades. É necessário comparecer presencialmente ao PROCON para uma análise detalhada."
      ],
      "base_legal": [
        { "norma": "CDC", "dispositivo": "Art. 35, III", "resumo": "Rescindir o contrato com restituição atualizada e perdas e danos" }
      ],
      "encaminhamento": "agendamento_presencial"
    },
    "orienta_aguardar": {
      "tipo": "orientacao",
      "texto": "Como o prazo prometido ainda não venceu, por ora não há descumprimento por parte da empresa e não é possível abrir uma reclamação por atraso.\n\nO que vale fazer agora é guardar o comprovante da compra com o prazo de entrega registrado. Se você tiver o print da página no momento da compra ou o e-mail de confirmação, melhor ainda.\n\nSe o prazo vencer sem a entrega, você poderá escolher entre exigir a entrega, aceitar um produto equivalente ou cancelar com reembolso. Volte a falar comigo se isso acontecer.",
      "documentos": [
        "Comprovante da compra com o prazo de entrega prometido",
        "Comprovantes de pagamento"
      ],
      "ressalvas": [
        "A reclamação por atraso só cabe após o vencimento do prazo prometido."
      ],
      "base_legal": [
        { "norma": "CDC", "dispositivo": "Art. 30" }
      ],
      "encaminhamento": "informativo"
    },
    "orienta_verificar_prazo": {
      "tipo": "orientacao",
      "texto": "Para saber se houve descumprimento, primeiro é preciso identificar qual prazo foi prometido.\n\nOnde procurar: no e-mail de confirmação do pedido, na página de acompanhamento do site ou aplicativo, no comprovante da compra, ou na própria página do produto no momento em que você comprou.\n\nO prazo anunciado obriga a empresa, porque a informação passada na oferta integra o contrato. Guarde esse registro. Com o prazo identificado, você saberá se já pode reclamar do atraso.",
      "documentos": [
        "Comprovante ou e-mail de confirmação da compra",
        "Print da página do produto ou do acompanhamento do pedido"
      ],
      "ressalvas": [
        "Sem identificar o prazo prometido não é possível caracterizar o atraso."
      ],
      "base_legal": [
        { "norma": "CDC", "dispositivo": "Art. 30", "resumo": "A informação veiculada obriga o fornecedor e integra o contrato" }
      ],
      "encaminhamento": "informativo"
    }
  }
}
